{
  "files": [
    {
      "bytes": 74,
      "path": ".gitignore",
      "sha256": "sha256:b52a9b1ceec6e900e6f30cb7feca69b0bb892769e2d02bdaced1e6036b992134"
    },
    {
      "bytes": 2381,
      "path": "README.md",
      "sha256": "sha256:687322649a72923c767bbc4b9f697dd558076f673af05a2d06e5512bef6bbeb8"
    },
    {
      "bytes": 81,
      "path": "next-env.d.ts",
      "sha256": "sha256:879741880b6ab48da99dcc06dcc674d381c9826137b0496bf7bb368f302de9fc"
    },
    {
      "bytes": 369,
      "path": "next.config.ts",
      "sha256": "sha256:2b6343f109c636cf8bdee2c011a4817056930e6d8fb09407d73deb37b553dcac"
    },
    {
      "bytes": 32543,
      "path": "package-lock.json",
      "sha256": "sha256:5c24d272fefcc467a7a918071fda7e9bd434d1755c1bc02bc6b822789f792828"
    },
    {
      "bytes": 676,
      "path": "package.json",
      "sha256": "sha256:c59131d5b68152323058455ae93e0d1dcf30c81169049a4ea709d64d7c624b90"
    },
    {
      "bytes": 319,
      "path": "playwright.config.ts",
      "sha256": "sha256:aef5a8e70d884cbc354e172561d817e6e20775cfa7258a09aa4d995156440124"
    },
    {
      "bytes": 457,
      "path": "src/app/layout.tsx",
      "sha256": "sha256:7e823308b9648b3d95a39993d711c9591899c335755e1dc5c0170644c800f323"
    },
    {
      "bytes": 172,
      "path": "src/app/page.tsx",
      "sha256": "sha256:78b6c24cc1b7af609c676e4e8ee787664e1169a0657e11df65e59d3f56a1fe56"
    },
    {
      "bytes": 3280,
      "path": "src/components/ContactForm.tsx",
      "sha256": "sha256:5449067d8e1efe6a2532a868d3a7133ab24dacdec321b2e2b4fccfe23fc7fd46"
    },
    {
      "bytes": 1365,
      "path": "src/components/CorporateSite.tsx",
      "sha256": "sha256:0e9d0f331e09c86cb36d37d7b9e5183e8c000fec6b158971ec19858f86ba27f6"
    },
    {
      "bytes": 3534,
      "path": "src/components/DemoChat.tsx",
      "sha256": "sha256:c5cac7ae4bfc9a908d65210be3bb4c805824fdc9b91a1839830e3b00d6a461c4"
    },
    {
      "bytes": 1830,
      "path": "src/components/DomainSearch.tsx",
      "sha256": "sha256:65a803aae18d5e49505000edf9b65cdc7102fff0e12cfff1de3b7199b8dc24b3"
    },
    {
      "bytes": 2166,
      "path": "src/components/Inquiry.tsx",
      "sha256": "sha256:a935e8033f06db727ff4a5f7cd8ca0dcd2405646a2992e9ecbd9d659e4313aff"
    },
    {
      "bytes": 1315,
      "path": "src/components/InquiryState.tsx",
      "sha256": "sha256:3fa8de1ca88050d76e27bba5e38e5f683f65f2ba110e91bfdf0069d90f5fc760"
    },
    {
      "bytes": 1261,
      "path": "src/components/Navigation.tsx",
      "sha256": "sha256:f03a1936f3ea76c4f556ec3d07999ecdb98d0ee439ca44953fe3dfea16c1d709"
    },
    {
      "bytes": 2749,
      "path": "src/components/Sections.tsx",
      "sha256": "sha256:ade309f2937bc941a2d12146edeed6204b0890da83c1dafd4904d250748abf8b"
    },
    {
      "bytes": 792,
      "path": "src/components/SelectionButtons.tsx",
      "sha256": "sha256:7f9aa3196a2bdbc40c25e6140336ced08f2cef98f7e1abada8f98f2625d47918"
    },
    {
      "bytes": 8162,
      "path": "src/components/Site.module.css",
      "sha256": "sha256:3ffe871b3a1a50ed351d7838ccde8fe4080a672d8443b66b5c108dcb7025d926"
    },
    {
      "bytes": 238,
      "path": "src/content/index.ts",
      "sha256": "sha256:51a72c33d7bd8324c3dc382088d28ba68214e20203df3c994e61424fd54188c0"
    },
    {
      "bytes": 814,
      "path": "src/content/site.json",
      "sha256": "sha256:9613cf89052c5493b40108d5873e6b619123e8a84747fe4d472bacc91317e6e6"
    },
    {
      "bytes": 429,
      "path": "src/content/types.ts",
      "sha256": "sha256:701fbac97359f652d58c5073273440484025f10d496d095d94f768590dc04526"
    },
    {
      "bytes": 3031,
      "path": "src/services/interactions.ts",
      "sha256": "sha256:711d4e241b51beb53668b98ed34d318c526f1299d997fb04f6ceefcdfe9581da"
    },
    {
      "bytes": 781,
      "path": "src/styles/globals.css",
      "sha256": "sha256:d2013254cb6b9035b38a83adf75cbaedd598deece955b0c64a2bc7ce1d78350f"
    },
    {
      "bytes": 376,
      "path": "src/styles/tokens.css",
      "sha256": "sha256:5defb59338e858de153ecb9b59de234f51b4f30d4a2ea3c0665c03d6a8e93cd8"
    },
    {
      "bytes": 8300,
      "path": "tests/browser/interactions.spec.ts",
      "sha256": "sha256:6255e888e423dd95c39d9729fbf9c4b2e87b68b8dd3fed48386bffda9bf5e71f"
    },
    {
      "bytes": 1989,
      "path": "tests/browser/services.spec.ts",
      "sha256": "sha256:fe8a2fd72315500de9056783c518744d66f883c6c82e7e5894714965c8f44f4c"
    },
    {
      "bytes": 2537,
      "path": "tests/browser/visual.spec.ts",
      "sha256": "sha256:1410061bf416d204d679d6a2448a553b77c25408ed925400f4948320bd152cc4"
    },
    {
      "bytes": 853,
      "path": "tests/content.test.mjs",
      "sha256": "sha256:37fa2540a8fdad4832d053288c178476c3c39df92562271f0eacb2905830fb15"
    },
    {
      "bytes": 608,
      "path": "tsconfig.json",
      "sha256": "sha256:788fe1cecadd2e6f12879900b8adc6c49b8cdf30e1c78999f9d791d3e86251e5"
    }
  ],
  "format": "nexonova.template.v1",
  "template_id": "corporate-site",
  "version": "0.1.0"
}
